{
  "$schema": "https://json-schema.org/draft/2020-12/schema",
  "$id": "https://coad.dev/schema/execution-ledger.schema.json",
  "title": "COAD Execution Ledger",
  "type": "object",
  "required": ["schema_version", "kind", "run_id", "goal_id", "entries"],
  "additionalProperties": false,
  "properties": {
    "schema_version": {
      "const": 1
    },
    "kind": {
      "const": "execution_ledger"
    },
    "run_id": {
      "type": "string",
      "minLength": 1
    },
    "goal_id": {
      "type": "string",
      "minLength": 1
    },
    "entries": {
      "type": "array",
      "minItems": 1,
      "items": {
        "$ref": "#/$defs/entry"
      }
    }
  },
  "$defs": {
    "entry": {
      "type": "object",
      "required": [
        "event_id",
        "task_id",
        "wave",
        "agent_id",
        "role",
        "status",
        "started_at",
        "proof_results",
        "changed_files"
      ],
      "additionalProperties": false,
      "properties": {
        "event_id": {
          "type": "string",
          "minLength": 1
        },
        "task_id": {
          "type": "string",
          "minLength": 1
        },
        "wave": {
          "type": "integer",
          "minimum": 1
        },
        "agent_id": {
          "type": "string",
          "minLength": 1
        },
        "role": {
          "type": "string",
          "minLength": 1
        },
        "status": {
          "enum": ["started", "completed", "blocked", "failed", "cancelled"]
        },
        "started_at": {
          "type": "string",
          "minLength": 1
        },
        "completed_at": {
          "type": "string",
          "minLength": 1
        },
        "proof_results": {
          "type": "array",
          "items": {
            "$ref": "#/$defs/proof_result"
          }
        },
        "changed_files": {
          "type": "array",
          "items": {
            "type": "string",
            "minLength": 1
          }
        },
        "handoff_path": {
          "type": "string",
          "minLength": 1
        },
        "notes": {
          "type": "array",
          "items": {
            "type": "string",
            "minLength": 1
          }
        }
      }
    },
    "proof_result": {
      "type": "object",
      "required": ["command", "status"],
      "additionalProperties": false,
      "allOf": [
        {
          "if": {
            "properties": {
              "status": {
                "const": "pass"
              }
            },
            "required": ["status"]
          },
          "then": {
            "required": ["artifact", "artifact_sha256", "artifact_bytes"]
          }
        }
      ],
      "properties": {
        "command": {
          "type": "string",
          "minLength": 1
        },
        "status": {
          "enum": ["pass", "fail", "skipped", "blocked"]
        },
        "artifact": {
          "type": "string",
          "minLength": 1
        },
        "artifact_sha256": {
          "type": "string",
          "pattern": "^[a-f0-9]{64}$"
        },
        "artifact_bytes": {
          "type": "integer",
          "minimum": 0
        }
      }
    }
  }
}
