{
  "schema_version": 1,
  "kind": "execution_ledger",
  "run_id": "run-checkout-negative-total-example",
  "goal_id": "checkout-negative-total-hardening",
  "entries": [
    {
      "event_id": "event-checkout-negative-total-completed",
      "task_id": "checkout-negative-total-guard",
      "wave": 1,
      "agent_id": "codex-example",
      "role": "executor",
      "status": "completed",
      "started_at": "2026-05-16T11:00:00Z",
      "completed_at": "2026-05-16T11:05:00Z",
      "proof_results": [
        {
          "command": "test checkout.checkout_service.rejects_negative_total",
          "status": "pass",
          "artifact": "artifacts/unit-test.txt",
          "artifact_sha256": "d4102b3b69047a96c82dfb2e7ef1075d72e36ec4ca27607b65ff44f09e24dac7",
          "artifact_bytes": 22
        },
        {
          "command": "test schemas/checkout-decision.schema.json",
          "status": "pass",
          "artifact": "artifacts/schema-test.txt",
          "artifact_sha256": "8381ae355daad4957a1803af2445d3dfdbf95312ebf600b248c5b0a9547cf1a3",
          "artifact_bytes": 24
        }
      ],
      "changed_files": [
        "checkout/checkout_service.py",
        "checkout/test_checkout_service.py"
      ],
      "handoff_path": "HANDOFF.md"
    }
  ]
}
